{
  "entity": "F-01kzwwsjvcbcxf5vpee4g2s4mc",
  "task": null,
  "kind": "approval",
  "approval_id": "E-01kzwxfdahr5e7aasre121254c",
  "phase": "applied",
  "action": "observation.resolve",
  "payload": {
    "disposition": "create-contract",
    "surface": "cli"
  },
  "source_message": "E-01kzwxfdahcj34683y4c0s390b",
  "id": "E-01kzwxfdajdvzeprkhbbh5b0rs",
  "created_at": "2026-08-13T06:38:11.282Z"
}
