{
  "entity": "T-01kzzs5jvsdz9ahjx77h9dd54m",
  "task": "T-01kzzs5jvsdz9ahjx77h9dd54m",
  "kind": "approval",
  "approval_id": "E-01m002ttezqaty3h0e96j3qs5s",
  "phase": "approved",
  "action": "task.request-changes",
  "payload": {
    "surface": "cli"
  },
  "source_message": "E-01m002ttez6m86rjw698pms9f4",
  "id": "E-01m002ttez7ddvhy9bp61sav3v",
  "created_at": "2026-08-14T12:09:31.359Z"
}
