{
  "entity": "T-01m0t6y6mrz2qv285gqfanyvza",
  "task": "T-01m0t6y6mrz2qv285gqfanyvza",
  "kind": "approval",
  "approval_id": "E-01m0t825x8nyrvjz6j2fs5f8k6",
  "phase": "applied",
  "action": "task.close",
  "payload": {
    "surface": "cli"
  },
  "source_message": "E-01m0t825x9yv09w4rpcwa71cj8",
  "id": "E-01m0t825x9aaxwqzdpwyc78wmh",
  "created_at": "2026-08-24T16:01:10.569Z"
}
