{
  "id": "E-01m007pxh6dj4v43vxnkctjgbv",
  "entity": "T-01kzzs5jvsdz9ahjx77h9dd54m",
  "task": "T-01kzzs5jvsdz9ahjx77h9dd54m",
  "kind": "approval",
  "approval_id": "E-01m007pxh6dj4v43vxnkctjgbv",
  "phase": "proposed",
  "action": "task.close",
  "payload": {
    "surface": "cli"
  },
  "source_message": null,
  "created_at": "2026-08-14T13:34:46.310Z"
}
