{
  "entity": "F-01kz1kb601ce79vwj48et554b5",
  "task": "T-01kz1g2vvgqvvzef92qdtczv8w",
  "kind": "approval",
  "approval_id": "E-01m0jdq14fj1cyhhn1wkv09py7",
  "phase": "approved",
  "action": "observation.resolve",
  "payload": {
    "disposition": "reject",
    "surface": "cli"
  },
  "source_message": "E-01m0jdq14fcwbzcehtdagxd27m",
  "id": "E-01m0jdq14f2nbhvf9g3yypx3me",
  "created_at": "2026-08-21T15:06:01.231Z"
}
