{
  "entity": "T-01m0hrtpfkq3bx3mmd25073me5",
  "task": "T-01m0hrtpfkq3bx3mmd25073me5",
  "kind": "lifecycle",
  "state": "active",
  "summary": "Execution started on claude/graft-kottara-837884 with claude from HEAD at c16571e7aec6a2e79ff611ed301d28bc2ba8ada8, adopting the only checkout; Kotta created no branch and no worktree.",
  "id": "E-01m0hs04szk8t6467hrz5mnfkq",
  "created_at": "2026-08-21T09:03:59.807Z"
}
