{
  "entity": "T-01kzm8xg1hmp20dgy545rgq6mc",
  "task": "T-01kzm8xg1hmp20dgy545rgq6mc",
  "kind": "lifecycle",
  "state": "active",
  "summary": "Execution started on feat/T-01kzm8xg1hmp20dgy545rgq6mc-contracts-and-observations-can-be-listed with claude.",
  "id": "E-01kzm9a4d6q2kpnrx8wbb068q3",
  "created_at": "2026-08-09T22:11:51.337Z"
}
