{
  "entity": "T-01kzda6d8qr4yxqcb41yd5vn20",
  "task": "T-01kzda6d8qr4yxqcb41yd5vn20",
  "kind": "lifecycle",
  "state": "active",
  "summary": "Execution started on refactor/T-01kzda6d8qr4yxqcb41yd5vn20-definecontract-accepts-definition-content-instead-of-a-files with claude.",
  "id": "E-01kzde3106r1pm9c54qxnz4epf",
  "created_at": "2026-08-07T06:20:40.326Z"
}
