{
  "entity": "T-01m0xraxm6k5mbbr266b4q8b91",
  "task": "T-01m0xraxm6k5mbbr266b4q8b91",
  "kind": "lifecycle",
  "state": "defined",
  "summary": "Task definition validated for accepted-spec coverage; the task is defined.",
  "id": "E-01m0xrbrh3g9h7xyw2eqnpfphr",
  "created_at": "2026-08-26T00:43:45.059Z"
}
