{
  "id": "E-01m0jmhb78eraegq30r7c9bhn6",
  "entity": "F-01m0fp0k01d8hy795n8amqckd2",
  "task": null,
  "kind": "approval",
  "approval_id": "E-01m0jmhb78eraegq30r7c9bhn6",
  "phase": "proposed",
  "action": "observation.resolve",
  "payload": {
    "disposition": "amend-spec",
    "spec": [
      "GT-01m0jksma4w2aqeeasvp8d8393"
    ],
    "surface": "cli"
  },
  "source_message": null,
  "created_at": "2026-08-21T17:05:14.984Z"
}
