{
  "entity": "T-01m0jdnv5fjechrfqwphvrrgqx",
  "task": "T-01m0jdnv5fjechrfqwphvrrgqx",
  "kind": "approval",
  "approval_id": "E-01m0zks0tkszxby9zna0q13v61",
  "phase": "approved",
  "action": "task.close",
  "payload": {
    "surface": "cli"
  },
  "source_message": "E-01m0zks0tkfa7xp032bdzdrb5s",
  "id": "E-01m0zks0tkr3ds5sdr28e7m8xx",
  "created_at": "2026-08-26T18:02:05.523Z"
}
