{
  "entity": "F-021",
  "task": null,
  "kind": "approval",
  "approval_id": "E-01m121nybzthz0evsrx6kv36nb",
  "phase": "applied",
  "action": "observation.resolve",
  "payload": {
    "disposition": "amend-spec",
    "spec": [
      "E-01m0f0wn89cry06jvtwtmpk4fr"
    ],
    "surface": "cli"
  },
  "source_message": "E-01m121nybz4sank25vede2gqmg",
  "id": "E-01m121nybz1thjy8eyycy5par6",
  "created_at": "2026-08-27T16:43:33.631Z"
}
