{
  "id": "E-01m0jdq498cm7pc4rhdm7n572x",
  "entity": "F-01kz26mjpax1387cnjphd95n90",
  "task": null,
  "kind": "approval",
  "approval_id": "E-01m0jdq498cm7pc4rhdm7n572x",
  "phase": "proposed",
  "action": "observation.resolve",
  "payload": {
    "disposition": "reject",
    "surface": "cli"
  },
  "source_message": null,
  "created_at": "2026-08-21T15:06:04.456Z"
}
